{
  "case_id": "g130_a1_same_item_multiple_quantity",
  "intent": "Explicit purchased quantity remains distinct from package count and package content in the same item.",
  "expected": {},
  "render": {
    "locale": "ja-JP",
    "paper_width": "58mm",
    "font": "monospace",
    "custom_lines": [
      "サンプル計量レシート",
      "領収書",
      "------------------------",
      "検証品A08 3袋入（各100g）",
      "税込 ¥271/100g",
      "計量 0.450kg",
      "------------------------",
      "ご利用ありがとうございました"
    ]
  },
  "degradation": { "enabled": false, "profile": null },
  "ground_truth": {
    "defined_before_image_generation": true,
    "items": [
      {
        "item_index": 0,
        "evidence_class": "reference_pricing",
        "printed_line_total": null,
        "existing_authority": false,
        "same_item_evidence": true,
        "dimension_compatible": true,
        "item_local_tax_rate": null,
        "tax_rounding_mode": "round",
        "tax_rate_conflict": false,
        "package_conflict": false,
        "discount_conflict": false,
        "deterministic_projection": true,
        "projection_within_bounds": true,
        "projected_gross_line_total": 1220,
        "adoption_outcome": "eligible",
        "adoption_blocking_reasons": []
      }
    ],
    "expected_candidates": [
      {
        "item_index": 0,
        "validation_state": "valid",
        "rejection_reasons": [],
        "reference_price_amount": "271",
        "reference_quantity": "100",
        "reference_unit_code": "gram",
        "purchased_quantity": "0.45",
        "purchased_unit_code": "kilogram",
        "reference_price_tax_inclusion": "gross",
        "projected_line_total": 1220,
        "printed_line_total": null,
        "rounding_matches": []
      }
    ],
    "expected_associations": [
      { "candidate_index": 0, "item_index": 0, "evidence_scope": "same_item" }
    ]
  }
}
