{
  "case_id": "g126_a1_column_separated",
  "intent": "Column-separated price, basis quantity, and purchased quantity stay associated with one item.",
  "expected": {},
  "render": {
    "locale": "ja-JP",
    "paper_width": "80mm",
    "font": "monospace",
    "custom_lines": [
      "サンプル計量レシート",
      "領収書",
      "--------------------------------",
      "検証品A04",
      "基準単価(税込) | 基準量 | 計量",
      "¥317            | 100g   | 275g",
      "--------------------------------",
      "ご利用ありがとうございました"
    ]
  },
  "degradation": { "enabled": false, "profile": null },
  "ground_truth": {
    "defined_before_image_generation": true,
    "items": [
      {
        "item_index": 0,
        "evidence_class": "reference_pricing",
        "printed_line_total": null,
        "existing_authority": false,
        "same_item_evidence": true,
        "dimension_compatible": true,
        "item_local_tax_rate": null,
        "tax_rounding_mode": "round",
        "tax_rate_conflict": false,
        "package_conflict": false,
        "discount_conflict": false,
        "deterministic_projection": true,
        "projection_within_bounds": true,
        "projected_gross_line_total": 872,
        "adoption_outcome": "eligible",
        "adoption_blocking_reasons": []
      }
    ],
    "expected_candidates": [
      {
        "item_index": 0,
        "validation_state": "valid",
        "rejection_reasons": [],
        "reference_price_amount": "317",
        "reference_quantity": "100",
        "reference_unit_code": "gram",
        "purchased_quantity": "275",
        "purchased_unit_code": "gram",
        "reference_price_tax_inclusion": "gross",
        "projected_line_total": 872,
        "printed_line_total": null,
        "rounding_matches": []
      }
    ],
    "expected_associations": [
      { "candidate_index": 0, "item_index": 0, "evidence_scope": "same_item" }
    ]
  }
}
